[
  {
    "passageId": "confederacy-passage-001",
    "caseId": "confederacy",
    "sourceId": "csa-constitution-1861",
    "locator": "Preamble, Constitution of the Confederate States of America, 11 March 1861; text verified at https://avalon.law.yale.edu/19th_century/csa_csa.asp",
    "text": "We, the people of the Confederate States, each State acting in its sovereign and independent character, in order to form a permanent federal government, establish justice, insure domestic tranquillity, and secure the blessings of liberty to ourselves and our posterity invoking the favor and guidance of Almighty God do ordain and establish this Constitution for the Confederate States of America.",
    "evidenceRole": "grounds",
    "reviewStatus": "evidence-review",
    "publicationStatus": "draft"
  },
  {
    "passageId": "confederacy-passage-002",
    "caseId": "confederacy",
    "sourceId": "stephens-cornerstone-speech-1861",
    "locator": "Alexander H. Stephens, 'Cornerstone Speech,' Savannah, Georgia, 21 March 1861; transcribed in Savannah Republican; text verified at https://www.battlefields.org/learn/primary-sources/cornerstone-speech",
    "text": "Our new government is founded upon exactly the opposite idea; its foundations are laid, its corner-stone rests, upon the great truth that the negro is not equal to the white man.",
    "evidenceRole": "grounds",
    "reviewStatus": "evidence-review",
    "publicationStatus": "draft"
  }
]
