[
  {
    "passageId": "british-empire-to-commonwealth-passage-001",
    "caseId": "british-empire-to-commonwealth",
    "sourceId": "balfour-declaration-1926",
    "locator": "Inter-Imperial Relations Committee Report (Balfour Declaration), 1926 Imperial Conference, approved 15 November 1926; text verified against The Canadian Encyclopedia: https://www.thecanadianencyclopedia.ca/en/article/document-balfour-report-1926 and Wikipedia: https://en.wikipedia.org/wiki/Balfour_Declaration_of_1926",
    "text": "autonomous Communities within the British Empire, equal in status, in no way subordinate one to another in any aspect of their domestic or external affairs, though united by a common allegiance to the Crown, and freely associated as members of the British Commonwealth of Nations",
    "evidenceRole": "grounds",
    "reviewStatus": "evidence-review",
    "publicationStatus": "draft"
  },
  {
    "passageId": "british-empire-to-commonwealth-passage-002",
    "caseId": "british-empire-to-commonwealth",
    "sourceId": "statute-of-westminster-1931",
    "locator": "Statute of Westminster 1931, 22 Geo. 5, c. 4, Preamble; text verified at https://www.legislation.gov.uk/ukpga/Geo5/22-23/4/introduction",
    "text": "inasmuch as the Crown is the symbol of the free association of the members of the British Commonwealth of Nations, and as they are united by a common allegiance to the Crown, it would be in accord with the established constitutional position of all the members of the Commonwealth in relation to one another that any alteration in the law touching the Succession to the Throne or the Royal Style and Titles shall hereafter require the assent as well of the Parliaments of all the Dominions as of the Parliament of the United Kingdom",
    "evidenceRole": "grounds",
    "reviewStatus": "evidence-review",
    "publicationStatus": "draft"
  }
]
