[
  {
    "passageId": "american-civil-war-union-passage-001",
    "caseId": "american-civil-war-union",
    "sourceId": "lincoln-gettysburg-address-1863",
    "locator": "Abraham Lincoln, Gettysburg Address, 19 November 1863, Soldiers' National Cemetery, Gettysburg PA; Bliss copy (definitive version); text verified at https://www.ushistory.org/documents/gettysburg.htm",
    "text": "It is rather for us to be here dedicated to the great task remaining before us—that from these honored dead we take increased devotion to that cause for which they gave the last full measure of devotion—that we here highly resolve that these dead shall not have died in vain—that this nation, under God, shall have a new birth of freedom—and that government of the people, by the people, for the people, shall not perish from the earth.",
    "evidenceRole": "grounds",
    "reviewStatus": "evidence-review",
    "publicationStatus": "draft"
  },
  {
    "passageId": "american-civil-war-union-passage-002",
    "caseId": "american-civil-war-union",
    "sourceId": "lincoln-second-inaugural-1865",
    "locator": "Abraham Lincoln, Second Inaugural Address, 4 March 1865; final paragraph; text verified at https://avalon.law.yale.edu/19th_century/lincoln2.asp",
    "text": "With malice toward none, with charity for all, with firmness in the right as God gives us to see the right, let us strive on to finish the work we are in, to bind up the nation's wounds, to care for him who shall have borne the battle and for his widow and his orphan, to do all which may achieve and cherish a just and lasting peace among ourselves and with all nations.",
    "evidenceRole": "grounds",
    "reviewStatus": "evidence-review",
    "publicationStatus": "draft"
  }
]
